[
 {"fr":"Aquéduc de Justinien","ota":{"latn":"Kovuk Kemer","arab":"قووق كمر"},"modern":"Kovukkemer (Eğrikemer), near Cebeciköy","lit":{"fr":{"en":"Aqueduct of Justinian","tr":"Justinianus Kemeri"},"ota":{"en":"Hollow Aqueduct","fr":"Aqueduc creux","tr":"Kovuk kemer"},"modern":null},"kind":"infrastructure","bbox":[4470,6474,4742,6506],"parts":null,"uncertain":false,"note":"Byzantine-origin aqueduct traditionally attributed to Justinian; also visible at the foot of the chunk above"},
 {"fr":"Kiosque Ruiné","ota":null,"modern":"Ruined kiosk south-east of Kemerburgaz (lost)","lit":{"fr":{"en":"Ruined Kiosk","tr":"Yıkık Köşk"},"ota":null,"modern":null},"kind":"ruin","bbox":[4442,6638,4604,6661],"parts":null,"uncertain":true,"note":"Descriptive label"},
 {"fr":"DGEBEDGI-KEUI","ota":{"latn":"Cebeci Köyü","arab":"جبه جی كوی"},"modern":"Cebeciköy, Eyüp","lit":{"fr":{"en":"Dgebedgi-Keui","tr":"Cebeciköy"},"ota":{"en":"Armourers' village","fr":"Village des armuriers","tr":"Cebeci köyü"},"modern":null},"kind":"village","bbox":[4785,6705,5021,6734],"parts":null,"uncertain":false,"note":null}
]