[
 {"fr":"Réservoir","ota":{"latn":"Havuz","arab":"حوض"},"modern":"Distribution basin below Büyük Bend, Belgrade Forest","lit":{"fr":{"en":"Reservoir","tr":"Rezervuar"},"ota":{"en":"Basin","fr":"Bassin","tr":"Havuz"},"modern":null},"kind":"infrastructure","bbox":[3464,5470,3585,5502],"parts":null,"uncertain":true,"note":"Round basin symbol drawn just south of GRAND BEND; part of the Belgrade Forest water system"}
]
