[
 {"fr":"Caranque","ota":null,"modern":"Caranque (unidentified)","lit":{"fr":{"en":"Caranque","tr":"Caranque"},"ota":null,"modern":null},"kind":"bay","bbox":[1849,3835,1937,3862],"parts":null,"uncertain":true,"note":{"en":"Small italic label on the Black Sea coast between Rumelifeneri and Kilyos; the reading (Caranque / Carangue) and the place are uncertain","fr":"Petite étiquette en italique sur la côte de la mer Noire entre Rumelifeneri et Kilyos ; la lecture (Caranque / Carangue) et le lieu sont incertains","tr":"Rumelifeneri ile Kilyos arasında Karadeniz kıyısında küçük italik etiket; okunuşu (Caranque / Carangue) ve yeri belirsiz"}}
]
