[
 {"fr":"Ruines d'un Vieux Château","ota":{"latn":"Aydos Kalesi","arab":"آیدوس قلعه سی"},"modern":"Aydos Kalesi, Sultanbeyli","lit":{"fr":{"en":"Ruins of an old castle","tr":"Eski bir kalenin kalıntıları"},"ota":{"en":"Castle of Aydos","fr":"Château d'Aydos","tr":"Aydos kalesi"},"modern":null},"kind":"ruin","bbox":[7296,832,7612,868],"parts":null,"uncertain":false,"note":"Byzantine castle on the summit of Aydos hill"},
 {"fr":"MONT AÏDOS","ota":{"latn":"Aydos Dağı","arab":"آیدوس طاغی"},"modern":"Aydos Dağı (Aydos Tepesi), Sultanbeyli/Kartal","lit":{"fr":{"en":"Mount Aidos","tr":"Aydos Dağı"},"ota":{"en":"Aydos Mountain","fr":"Mont Aydos","tr":"Aydos dağı"},"modern":null},"kind":"mountain","bbox":[7018,962,7484,1012],"parts":[[7018,968,7168,1012],[7280,962,7484,1012]],"uncertain":false,"note":"Letter-spaced label; highest hill on the Asian side of Istanbul"},
 {"fr":"Vieux Château","ota":null,"modern":"Damatrys Sarayı ruins, Samandıra","lit":{"fr":{"en":"Old castle","tr":"Eski kale"},"ota":null,"modern":null},"kind":"ruin","bbox":[7500,1464,7746,1500],"parts":null,"uncertain":true,"note":"Placed just above the village of Semen-Déré; probably the Byzantine palace of Damatrys"},
 {"fr":"SEMEN-DÉRÉ","ota":{"latn":"Samandıra","arab":"صمندره"},"modern":"Samandıra, Sancaktepe","lit":{"fr":{"en":"Semen-Déré","tr":"Samandıra"},"ota":{"en":"Samandıra","fr":"Samandıra","tr":"Samandıra"},"modern":null},"kind":"village","bbox":[7342,1636,7532,1670],"parts":null,"uncertain":true,"note":"French form suggests 'Semen deresi'; the name descends from Byzantine Damatrys"}
]
