[
 {
  "fr": "Cap Kara-Abondous",
  "ota": {
   "latn": "Kara Abondus Burnu",
   "arab": "قره آبوندوس بورنی"
  },
  "modern": "Unidentified cape north-west of Riva, Beykoz",
  "lit": {
   "fr": {
    "en": "Cape Kara-Abondous",
    "tr": "Kara-Abondous Burnu"
   },
   "ota": {
    "en": "Black Abondous Cape",
    "fr": "Cap Noir d'Abondous",
    "tr": "Kara Abondus burnu"
   },
   "modern": null
  },
  "kind": "cape",
  "bbox": [
   2660,
   885,
   2930,
   930
  ],
  "parts": null,
  "uncertain": true,
  "note": "Second word hard to read: Abondous / Aboudous; only 'Kara' (black) is sure"
 },
 {
  "fr": "I. de Riva",
  "ota": {
   "latn": "Riva Adası",
   "arab": "ریوا آطه سی"
  },
  "modern": "Islet off Riva (Riva Adası), Beykoz",
  "lit": {
   "fr": {
    "en": "Island of Riva",
    "tr": "Riva Adası"
   },
   "ota": {
    "en": "Island of Riva",
    "fr": "Île de Riva",
    "tr": "Riva adası"
   },
   "modern": null
  },
  "kind": "island",
  "bbox": [
   2691,
   1221,
   2874,
   1266
  ],
  "parts": null,
  "uncertain": false,
  "note": "Small rock off Riva"
 },
 {
  "fr": "RIVA",
  "ota": {
   "latn": "Riva",
   "arab": "ریوا"
  },
  "modern": "Riva, Beykoz",
  "lit": {
   "fr": {
    "en": "Riva",
    "tr": "Riva"
   },
   "ota": {
    "en": "Riva",
    "fr": "Riva",
    "tr": "Riva"
   },
   "modern": null
  },
  "kind": "village",
  "bbox": [
   3036,
   1306,
   3164,
   1354
  ],
  "parts": null,
  "uncertain": false,
  "note": "Greek Rhebas; Ottoman Riva / Çayağzı"
 },
 {
  "fr": "Château",
  "ota": {
   "latn": "Riva Kalesi",
   "arab": "ریوا قلعه سی"
  },
  "modern": "Riva Kalesi (Genoese castle), Beykoz",
  "lit": {
   "fr": {
    "en": "Castle",
    "tr": "Kale"
   },
   "ota": {
    "en": "Castle of Riva",
    "fr": "Château de Riva",
    "tr": "Riva kalesi"
   },
   "modern": null
  },
  "kind": "fort",
  "bbox": [
   2936,
   1366,
   3046,
   1410
  ],
  "parts": null,
  "uncertain": false,
  "note": "Generic word placed at the castle of Riva"
 },
 {
  "fr": "Cap de Riva",
  "ota": {
   "latn": "Riva Burnu",
   "arab": "ریوا بورنی"
  },
  "modern": "Riva Burnu, Beykoz",
  "lit": {
   "fr": {
    "en": "Cape of Riva",
    "tr": "Riva Burnu"
   },
   "ota": {
    "en": "Cape of Riva",
    "fr": "Cap de Riva",
    "tr": "Riva burnu"
   },
   "modern": null
  },
  "kind": "cape",
  "bbox": [
   2701,
   1416,
   2905,
   1464
  ],
  "parts": null,
  "uncertain": false,
  "note": null
 },
 {
  "fr": "Grande Vallée",
  "ota": null,
  "modern": "Riva Deresi valley, Beykoz",
  "lit": {
   "fr": {
    "en": "Great Valley",
    "tr": "Büyük Vadi"
   },
   "ota": null,
   "modern": null
  },
  "kind": "other",
  "bbox": [
   3350,
   1005,
   3570,
   1255
  ],
  "parts": [
   [
    3350,
    1115,
    3475,
    1255
   ],
   [
    3470,
    1005,
    3570,
    1115
   ]
  ],
  "uncertain": true,
  "note": "Curved label along the valley of the Riva stream"
 }
]