[
 {
  "fr": "BACHI-BUYUKLI",
  "ota": {
   "latn": "Başıbüyük",
   "arab": "باشی بیوك"
  },
  "modern": "Başıbüyük, Maltepe",
  "lit": {
   "fr": {
    "en": "Bachi-Buyukli",
    "tr": "Başıbüyüklü"
   },
   "ota": {
    "en": "Big-headed",
    "fr": "Grosse-tête",
    "tr": "Başı büyük"
   },
   "modern": {
    "en": "Big-headed",
    "fr": "Grosse-tête",
    "tr": "Başı büyük"
   }
  },
  "kind": "village",
  "bbox": [
   8042,
   3008,
   8258,
   3040
  ],
  "parts": null,
  "uncertain": true,
  "note": {
   "en": "Sits on the top edge of the chunk; the map writes the name with a -lü suffix",
   "fr": "Sur le bord supérieur de la tuile ; la carte écrit le nom avec un suffixe -lü.",
   "tr": "Parçanın üst kenarında; harita adı -lü ekiyle yazar."
  }
 },
 {
  "fr": "Bostandgi-Bachi-Kuprusi",
  "ota": {
   "latn": "Bostancıbaşı Köprüsü",
   "arab": "بوستانجی باشی كوپریسی"
  },
  "modern": "Bostancıbaşı Köprüsü, Bostancı",
  "lit": {
   "fr": {
    "en": "Bostandgi-Bachi bridge",
    "tr": "Bostancıbaşı Köprüsü"
   },
   "ota": {
    "en": "Bridge of the Chief Gardener",
    "fr": "Pont du Chef des Jardiniers",
    "tr": "Bostancıbaşı köprüsü"
   },
   "modern": {
    "en": "Bridge of the Chief Gardener",
    "fr": "Pont du chef des jardiniers",
    "tr": "Bostancıbaşı köprüsü"
   }
  },
  "kind": "infrastructure",
  "bbox": [
   8385,
   3318,
   8722,
   3352
  ],
  "parts": null,
  "uncertain": false,
  "note": {
   "en": "Marked the eastern limit of the capital's jurisdiction",
   "fr": "Marquait la limite orientale de la juridiction de la capitale.",
   "tr": "Başkentin yetki alanının doğu sınırını belirlerdi."
  }
 },
 {
  "fr": "Pont de pierre de 3 arches",
  "ota": null,
  "modern": "Bostancıbaşı Köprüsü, Bostancı",
  "lit": {
   "fr": {
    "en": "Stone bridge of 3 arches",
    "tr": "3 kemerli taş köprü"
   },
   "ota": null,
   "modern": {
    "en": "Bridge of the Chief Gardener",
    "fr": "Pont du chef des jardiniers",
    "tr": "Bostancıbaşı köprüsü"
   }
  },
  "kind": "infrastructure",
  "bbox": [
   8390,
   3348,
   8645,
   3378
  ],
  "parts": null,
  "uncertain": false,
  "note": {
   "en": "Descriptive second line under Bostandgi-Bachi-Kuprusi",
   "fr": "Seconde ligne descriptive sous Bostandgi-Bachi-Kuprusi.",
   "tr": "Bostandgi-Bachi-Kuprusi'nin altındaki açıklayıcı ikinci satır."
  }
 },
 {
  "fr": "Bordonos",
  "ota": {
   "latn": "Vordonos",
   "arab": "وردونوس"
  },
  "modern": "Vordonisi, Maltepe açıkları (submerged)",
  "lit": {
   "fr": {
    "en": "Bordonos",
    "tr": "Bordonos"
   },
   "ota": {
    "en": "Vordonos",
    "fr": "Vordonos",
    "tr": "Vordonos"
   },
   "modern": null
  },
  "kind": "island",
  "bbox": [
   9062,
   3298,
   9182,
   3332
  ],
  "parts": null,
  "uncertain": true,
  "note": {
   "en": "Rock drawn with a dotted outline; the islet is now under water. Ottoman form reconstructed from the Greek name",
   "fr": "Rocher dessiné en pointillé ; l'îlot est aujourd'hui sous l'eau. Forme ottomane reconstituée d'après le nom grec.",
   "tr": "Noktalı çizgiyle çizilmiş kaya; adacık bugün su altında. Osmanlıca biçim Yunanca addan türetilmiştir."
  }
 },
 {
  "fr": "Euréké-Tachi",
  "ota": {
   "latn": "Yürek Taşı",
   "arab": "یورك طاشی"
  },
  "modern": "Yürek Taşı, Maltepe açıkları (unidentified)",
  "lit": {
   "fr": {
    "en": "Euréké rock",
    "tr": "Euréké Taşı"
   },
   "ota": {
    "en": "Heart stone",
    "fr": "Pierre du cœur",
    "tr": "Yürek taşı"
   },
   "modern": {
    "en": "Heart rock",
    "fr": "Rocher du cœur",
    "tr": "Yürek taşı"
   }
  },
  "kind": "island",
  "bbox": [
   8762,
   3479,
   8915,
   3508
  ],
  "parts": null,
  "uncertain": true,
  "note": {
   "en": "Rock drawn with a dotted outline NW of the label. Turkish reading (Yürek Taşı) and identification are guesses",
   "fr": "Rocher dessiné en pointillé au nord-ouest de l'étiquette. La lecture turque (Yürek Taşı) et l'identification sont des hypothèses.",
   "tr": "Etiketin kuzeybatısında noktalı çizgiyle çizilmiş kaya. Türkçe okunuş (Yürek Taşı) ve kimlik tahmindir."
  }
 },
 {
  "fr": "Sera-Tachi",
  "ota": {
   "latn": "Sıra Taşı",
   "arab": "صیره طاشی"
  },
  "modern": "Sıra Taşı, Kınalıada (unidentified)",
  "lit": {
   "fr": {
    "en": "Sera rock",
    "tr": "Sera Taşı"
   },
   "ota": {
    "en": "Row Stone",
    "fr": "Pierre de la rangée",
    "tr": "Sıra taşı"
   },
   "modern": null
  },
  "kind": "island",
  "bbox": [
   9100,
   3596,
   9228,
   3622
  ],
  "parts": null,
  "uncertain": true,
  "note": {
   "en": "Rock drawn with a dotted outline above the label. Turkish reading (Sıra Taşı) and identification are guesses",
   "fr": "Rocher dessiné en pointillé au-dessus de l'étiquette. La lecture turque (Sıra Taşı) et l'identification sont des hypothèses.",
   "tr": "Etiketin üstünde noktalı çizgiyle çizilmiş kaya. Türkçe okunuş (Sıra Taşı) ve kimlik tahmindir."
  }
 },
 {
  "fr": "Pont de Pierre",
  "ota": null,
  "modern": "Taş köprü, Bağdat yolu (lost)",
  "lit": {
   "fr": {
    "en": "Stone Bridge",
    "tr": "Taş Köprü"
   },
   "ota": null,
   "modern": {
    "en": "Stone bridge on the Baghdad road",
    "fr": "Pont de pierre sur la route de Bagdad",
    "tr": "Bağdat yolu üzerinde taş köprü"
   }
  },
  "kind": "infrastructure",
  "bbox": [
   7958,
   3718,
   8125,
   3748
  ],
  "parts": null,
  "uncertain": true,
  "note": null
 },
 {
  "fr": "Pont de Bois",
  "ota": null,
  "modern": "Tahta köprü, Kurbağalıdere (lost)",
  "lit": {
   "fr": {
    "en": "Wooden Bridge",
    "tr": "Tahta Köprü"
   },
   "ota": null,
   "modern": {
    "en": "Wooden bridge over the Kurbağalıdere",
    "fr": "Pont de bois sur le Kurbağalıdere",
    "tr": "Kurbağalıdere üzerinde tahta köprü"
   }
  },
  "kind": "infrastructure",
  "bbox": [
   7790,
   4080,
   7938,
   4113
  ],
  "parts": null,
  "uncertain": true,
  "note": {
   "en": "Near Kızıltoprak",
   "fr": "Près de Kızıltoprak.",
   "tr": "Kızıltoprak yakınında."
  }
 }
]
