[
 {"fr":"PROTI","ota":{"latn":"Kınalıada","arab":"قنالی آطه"},"modern":"Kınalıada","lit":{"fr":{"en":"Proti","tr":"Proti"},"ota":{"en":"Henna Island","fr":"Île de Henné","tr":"Kınalı ada"},"modern":null},"kind":"island","bbox":[9295,4245,9428,4278],"parts":null,"uncertain":false,"note":"Greek Proti = 'the first' island; the Turkish name refers to its reddish soil"},
 {"fr":"PLATY","ota":{"latn":"Yassıada","arab":"یاصی آطه"},"modern":"Yassıada","lit":{"fr":{"en":"Platy","tr":"Platy"},"ota":{"en":"Flat Island","fr":"Île Plate","tr":"Yassı ada"},"modern":null},"kind":"island","bbox":[10242,4802,10371,4831],"parts":null,"uncertain":false,"note":"Greek platys = flat"},
 {"fr":"OXYA","ota":{"latn":"Sivriada","arab":"سیوری آطه"},"modern":"Sivriada","lit":{"fr":{"en":"Oxya","tr":"Oxya"},"ota":{"en":"Pointed Island","fr":"Île Pointue","tr":"Sivri ada"},"modern":null},"kind":"island","bbox":[9972,5175,10058,5202],"parts":null,"uncertain":false,"note":"Greek oxeia = sharp"},
 {"fr":"Ancien Môle","ota":null,"modern":"Ancient mole (Byzantine harbour works), Sivriada","lit":{"fr":{"en":"Old Mole","tr":"Eski Mendirek"},"ota":null,"modern":null},"kind":"infrastructure","bbox":[10112,5231,10224,5258],"parts":null,"uncertain":false,"note":null},
 {"fr":"Ruines d'une Citadelle","ota":null,"modern":"Ruins of the Byzantine citadel and monastery, Sivriada","lit":{"fr":{"en":"Ruins of a Citadel","tr":"Bir Kale Harabeleri"},"ota":null,"modern":null},"kind":"ruin","bbox":[10110,5303,10337,5328],"parts":null,"uncertain":false,"note":null}
]
