[
 {
  "fr": "PENDIK",
  "ota": {
   "latn": "Pendik",
   "arab": "پندیك"
  },
  "modern": "Pendik",
  "lit": {
   "fr": {
    "en": "Pendik",
    "tr": "Pendik"
   },
   "ota": {
    "en": "Pendik",
    "fr": "Pendik",
    "tr": "Pendik"
   },
   "modern": null
  },
  "kind": "village",
  "bbox": [
   9696,
   903,
   9808,
   932
  ],
  "parts": null,
  "uncertain": false,
  "note": {
   "en": "From Greek Pantichion",
   "fr": "Du grec Pantichion",
   "tr": "Yunanca Pantichion'dan"
  }
 },
 {
  "fr": "Citerne ancienne",
  "ota": null,
  "modern": "Eski sarnıç, Pendik (lost)",
  "lit": {
   "fr": {
    "en": "Ancient cistern",
    "tr": "Eski sarnıç"
   },
   "ota": null,
   "modern": {
    "en": "Ancient cistern",
    "fr": "Citerne ancienne",
    "tr": "Eski sarnıç"
   }
  },
  "kind": "ruin",
  "bbox": [
   9846,
   816,
   10014,
   844
  ],
  "parts": null,
  "uncertain": true,
  "note": null
 },
 {
  "fr": "Eglise Grecque",
  "ota": null,
  "modern": "Rum Ortodoks kilisesi, Pendik",
  "lit": {
   "fr": {
    "en": "Greek Church",
    "tr": "Rum Kilisesi"
   },
   "ota": null,
   "modern": {
    "en": "Greek Orthodox church",
    "fr": "Église grecque orthodoxe",
    "tr": "Rum Ortodoks kilisesi"
   }
  },
  "kind": "religious",
  "bbox": [
   9738,
   944,
   9866,
   982
  ],
  "parts": null,
  "uncertain": true,
  "note": {
   "en": "At Pendik",
   "fr": "À Pendik",
   "tr": "Pendik'te"
  }
 },
 {
  "fr": "KARTAL",
  "ota": {
   "latn": "Kartal",
   "arab": "قارتال"
  },
  "modern": "Kartal",
  "lit": {
   "fr": {
    "en": "Kartal",
    "tr": "Kartal"
   },
   "ota": {
    "en": "Eagle",
    "fr": "Aigle",
    "tr": "Kartal"
   },
   "modern": null
  },
  "kind": "village",
  "bbox": [
   9560,
   1768,
   9690,
   1802
  ],
  "parts": null,
  "uncertain": false,
  "note": {
   "en": "Greek Kartalimen",
   "fr": "Grec Kartalimen",
   "tr": "Yunanca Kartalimen"
  }
 },
 {
  "fr": "Karavanserai",
  "ota": {
   "latn": "Kervansaray",
   "arab": "كاروانسرای"
  },
  "modern": "Kartal kervansarayı (lost)",
  "lit": {
   "fr": {
    "en": "Caravanserai",
    "tr": "Kervansaray"
   },
   "ota": {
    "en": "Caravan palace",
    "fr": "Palais des caravanes",
    "tr": "Kervansaray"
   },
   "modern": {
    "en": "Kartal caravanserai",
    "fr": "Caravansérail de Kartal",
    "tr": "Kartal kervansarayı"
   }
  },
  "kind": "other",
  "bbox": [
   9615,
   1806,
   9745,
   1848
  ],
  "parts": null,
  "uncertain": true,
  "note": {
   "en": "Label partly hidden under the village plan",
   "fr": "Étiquette en partie cachée sous le plan du village",
   "tr": "Etiket kısmen köy planının altında kalıyor"
  }
 },
 {
  "fr": "Chateau ruiné",
  "ota": null,
  "modern": "Yıkık kale, Kartal (lost)",
  "lit": {
   "fr": {
    "en": "Ruined castle",
    "tr": "Yıkık kale"
   },
   "ota": null,
   "modern": {
    "en": "Ruined castle",
    "fr": "Château en ruine",
    "tr": "Yıkık kale"
   }
  },
  "kind": "ruin",
  "bbox": [
   9804,
   1798,
   9970,
   1832
  ],
  "parts": null,
  "uncertain": true,
  "note": null
 },
 {
  "fr": "Eglise Arménienne",
  "ota": null,
  "modern": "Surp Nişan Ermeni Kilisesi, Kartal",
  "lit": {
   "fr": {
    "en": "Armenian Church",
    "tr": "Ermeni Kilisesi"
   },
   "ota": null,
   "modern": {
    "en": "Surp Nişan (Holy Sign) Armenian church",
    "fr": "Église arménienne Surp Nişan (Saint-Signe)",
    "tr": "Surp Nişan Ermeni Kilisesi"
   }
  },
  "kind": "religious",
  "bbox": [
   9511,
   1893,
   9686,
   1922
  ],
  "parts": null,
  "uncertain": true,
  "note": {
   "en": "At Kartal",
   "fr": "À Kartal",
   "tr": "Kartal'da"
  }
 },
 {
  "fr": "Eglise Grecque",
  "ota": null,
  "modern": "Rum Ortodoks kilisesi, Kartal",
  "lit": {
   "fr": {
    "en": "Greek Church",
    "tr": "Rum Kilisesi"
   },
   "ota": null,
   "modern": {
    "en": "Greek Orthodox church",
    "fr": "Église grecque orthodoxe",
    "tr": "Rum Ortodoks kilisesi"
   }
  },
  "kind": "religious",
  "bbox": [
   9626,
   1926,
   9716,
   1986
  ],
  "parts": null,
  "uncertain": true,
  "note": {
   "en": "At Kartal, south of the village",
   "fr": "À Kartal, au sud du village",
   "tr": "Kartal'da, köyün güneyinde"
  }
 },
 {
  "fr": "AGADGIK",
  "ota": {
   "latn": "Ağacık",
   "arab": "آغاجق"
  },
  "modern": "Ağacık (unidentified)",
  "lit": {
   "fr": {
    "en": "Agadgik",
    "tr": "Ağacık"
   },
   "ota": {
    "en": "Little tree",
    "fr": "Petit arbre",
    "tr": "Ağaççık"
   },
   "modern": null
  },
  "kind": "village",
  "bbox": [
   9210,
   1818,
   9364,
   1854
  ],
  "parts": null,
  "uncertain": true,
  "note": {
   "en": "Possibly a garbled Yakacık, but IAKA-KEUI just to the west is the better match for that village; left unidentified",
   "fr": "Peut-être un Yakacık déformé, mais IAKA-KEUI juste à l’ouest correspond mieux à ce village ; laissé non identifié",
   "tr": "Bozulmuş bir Yakacık olabilir, ama hemen batıdaki IAKA-KEUI o köye daha iyi uyar; tanımlanmadan bırakıldı"
  }
 },
 {
  "fr": "Chemin de Nicomédie",
  "ota": {
   "latn": "İzmit Yolu",
   "arab": "ازمید یولی"
  },
  "modern": "Eski İzmit yolu",
  "lit": {
   "fr": {
    "en": "Road to Nicomedia",
    "tr": "İzmit Yolu"
   },
   "ota": {
    "en": "Road of İzmit",
    "fr": "Route d'Izmit",
    "tr": "İzmit yolu"
   },
   "modern": {
    "en": "Old İzmit road",
    "fr": "Ancienne route d'Izmit",
    "tr": "Eski İzmit yolu"
   }
  },
  "kind": "road",
  "bbox": [
   9258,
   1476,
   9830,
   2293
  ],
  "parts": [
   [
    9774,
    1476,
    9830,
    1628
   ],
   [
    9560,
    1932,
    9590,
    1963
   ],
   [
    9258,
    2232,
    9326,
    2293
   ]
  ],
  "uncertain": true,
  "note": {
   "en": "Ottoman form reconstructed; today roughly the Bağdat Caddesi / D-100 corridor. Three words strung along the coast road: Nicomédie near Pendik, de at Kartal, Chemin in chunk c_9100_1850",
   "fr": "Forme ottomane reconstituée ; aujourd'hui à peu près le corridor Bağdat Caddesi / D-100. Trois mots égrenés le long de la route côtière : Nicomédie près de Pendik, de à Kartal, Chemin dans le fragment c_9100_1850",
   "tr": "Osmanlıca biçim türetildi; bugün aşağı yukarı Bağdat Caddesi / D-100 hattı. Sahil yolu boyunca dizilmiş üç kelime: Nicomédie Pendik yakınında, de Kartal'da, Chemin c_9100_1850 parçasında"
  }
 }
]
