[
 {"fr":"Ruines d'une Citadelle","ota":null,"modern":"Citadel ruins, Sivriada","lit":{"fr":{"en":"Ruins of a Citadel","tr":"Bir Kalenin Harabeleri"},"ota":null,"modern":null},"kind":"ruin","bbox":[10110,5303,10337,5328],"parts":null,"uncertain":false,"note":"On Sivriada (OXYA); duplicate of the record in c_9100_4150, which holds the label whole. A short illegible word under the islet hatching precedes 'Ruines'"}
]
