[
 {"fr":"TCHENGHEL-KEUI","ota":{"latn":"Çengelköy","arab":"چنكل كوی"},"modern":"Çengelköy, Üsküdar","lit":{"fr":{"en":"Tchenghel-keui","tr":"Çengelköy"},"ota":{"en":"Hook Village","fr":"Village du Crochet","tr":"Çengel köyü"},"modern":{"en":"Hook village","fr":"Village du Crochet","tr":"Çengel köyü"}},"kind":"village","bbox":[6303,3928,6560,3962],"parts":null,"uncertain":false,"note":{"en":"Cut by the right edge of this chunk and the left edge of c_6400_3000; read from a zoom render across the boundary","fr":"Coupé par le bord droit de cette tuile et le bord gauche de c_6400_3000 ; lu sur un zoom à cheval sur la limite","tr":"Bu parçanın sağ, c_6400_3000'in sol kenarında kesik; sınırı aşan bir yakınlaştırmadan okundu"}}
]