[
  {
    "fr": "ABDULAR",
    "ota": {
      "latn": "Abdullar",
      "arab": "عبداللر"
    },
    "modern": "Abdullar, Beykoz (unidentified)",
    "lit": {
      "fr": {
        "en": "Abdular",
        "tr": "Abdullar"
      },
      "ota": {
        "en": "Abdullar",
        "fr": "Abdullar",
        "tr": "Abdullar"
      },
      "modern": null
    },
    "kind": "village",
    "bbox": [
      3880,
      1922,
      3990,
      1952
    ],
    "parts": null,
    "uncertain": true,
    "note": {
      "en": "Village with a mosque in the Beykoz hills, on the road north from Arnavutköy toward the Black Sea coast; site not identified.",
      "fr": "Village avec mosquée dans les collines de Beykoz, sur la route qui monte d'Arnavutköy vers la mer Noire ; site non identifié.",
      "tr": "Beykoz tepelerinde, Arnavutköy'den Karadeniz kıyısına giden yol üzerinde camili köy; yeri belirlenemedi."
    }
  },
  {
    "fr": "ARNAOUT-KEUI",
    "ota": {
      "latn": "Arnavud Köyü",
      "arab": "آرناوود كوی"
    },
    "modern": "Arnavutköy, Beykoz",
    "lit": {
      "fr": {
        "en": "Albanian Village",
        "tr": "Arnavut Köyü"
      },
      "ota": {
        "en": "Village of the Albanians",
        "fr": "Village des Albanais",
        "tr": "Arnavut köyü"
      },
      "modern": {
        "en": "Albanian village",
        "fr": "Village des Albanais",
        "tr": "Arnavut köyü"
      }
    },
    "kind": "village",
    "bbox": [
      4405,
      2488,
      4642,
      2516
    ],
    "parts": null,
    "uncertain": false,
    "note": {
      "en": "The inland Arnavutköy of Beykoz, not the Bosphorus-side one",
      "fr": "L'Arnavutköy de l'intérieur, à Beykoz, et non celui du bord du Bosphore",
      "tr": "Beykoz'un iç kesimindeki Arnavutköy; Boğaz kıyısındaki değil"
    }
  },
  {
    "fr": "Fontaine minérale de Karakoulak",
    "ota": {
      "latn": "Karakulak Suyu",
      "arab": "قره قولاق صویی"
    },
    "modern": "Karakulak Suyu, Beykoz",
    "lit": {
      "fr": {
        "en": "Mineral spring of Karakoulak",
        "tr": "Karakulak maden suyu"
      },
      "ota": {
        "en": "Black-Ear Water",
        "fr": "Eau de l'Oreille-Noire",
        "tr": "Karakulak suyu"
      },
      "modern": {
        "en": "Black-Ear water",
        "fr": "Eau de l'Oreille-Noire",
        "tr": "Karakulak suyu"
      }
    },
    "kind": "infrastructure",
    "bbox": [
      4286,
      2760,
      4444,
      2814
    ],
    "parts": [
      [
        4300,
        2760,
        4444,
        2784
      ],
      [
        4286,
        2788,
        4444,
        2814
      ]
    ],
    "uncertain": false,
    "note": {
      "en": "Renowned spring water of the Beykoz hills; two-line label",
      "fr": "Eau de source réputée des collines de Beykoz ; étiquette sur deux lignes",
      "tr": "Beykoz tepelerinin ünlü kaynak suyu; iki satırlık etiket"
    }
  },
  {
    "fr": "ZÉKÉ-DÉRÉ",
    "ota": {
      "latn": "Zeke Dere",
      "arab": "زكه دره"
    },
    "modern": "Dereseki, Beykoz (probable)",
    "lit": {
      "fr": {
        "en": "Zéké-Déré",
        "tr": "Zeke Dere"
      },
      "ota": {
        "en": "Zeke Stream",
        "fr": "Ruisseau de Zeke",
        "tr": "Zeke deresi"
      },
      "modern": {
        "en": "Stream terrace",
        "fr": "Terrasse du ruisseau",
        "tr": "Dere seki"
      }
    },
    "kind": "village",
    "bbox": [
      4342,
      2872,
      4518,
      2902
    ],
    "parts": null,
    "uncertain": true,
    "note": {
      "en": "Village with a mosque between Karakulak and Akbaba; identification with Dereseki is a guess",
      "fr": "Village avec mosquée entre Karakulak et Akbaba ; l'identification avec Dereseki est une hypothèse",
      "tr": "Karakulak ile Akbaba arasında camili köy; Dereseki ile özdeşleştirme bir tahmindir"
    }
  },
  {
    "fr": "AK-BABA",
    "ota": {
      "latn": "Akbaba",
      "arab": "آق بابا"
    },
    "modern": "Akbaba, Beykoz",
    "lit": {
      "fr": {
        "en": "White Father",
        "tr": "Akbaba"
      },
      "ota": {
        "en": "White Father",
        "fr": "Père Blanc",
        "tr": "Ak baba"
      },
      "modern": {
        "en": "White Father",
        "fr": "Père Blanc",
        "tr": "Ak baba"
      }
    },
    "kind": "village",
    "bbox": [
      4352,
      2988,
      4482,
      3014
    ],
    "parts": null,
    "uncertain": false,
    "note": {
      "en": "Named after the tekke of Akbaba Sultan",
      "fr": "Nommé d'après le tekké d'Akbaba Sultan",
      "tr": "Adını Akbaba Sultan tekkesinden alır"
    }
  },
  {
    "fr": "Fontaine de St Constantin",
    "ota": {
      "latn": "Aya Konstantin Ayazması",
      "arab": "آیا قسطنطین آیازمه سی"
    },
    "modern": "Aya Konstantin Ayazması, Beykoz (unidentified)",
    "lit": {
      "fr": {
        "en": "Fountain of St Constantine",
        "tr": "Aziz Konstantin Çeşmesi"
      },
      "ota": {
        "en": "Holy spring of St Constantine",
        "fr": "Source sacrée de Saint-Constantin",
        "tr": "Aya Konstantin ayazması"
      },
      "modern": {
        "en": "Saint Constantine's holy spring",
        "fr": "Source sacrée de Saint-Constantin",
        "tr": "Aya Konstantin ayazması"
      }
    },
    "kind": "infrastructure",
    "bbox": [
      4688,
      3086,
      4932,
      3114
    ],
    "parts": null,
    "uncertain": true,
    "note": {
      "en": "Greek holy spring (ayazma) near Sultaniye on the road from Beykoz; the Ottoman form is inferred.",
      "fr": "Source sacrée grecque (ayazma) près de Sultaniye, sur la route venant de Beykoz ; la forme ottomane est déduite.",
      "tr": "Beykoz'dan gelen yol üzerinde, Sultaniye yakınında Rum ayazması; Osmanlıca biçimi çıkarımdır."
    }
  }
]
