[
 {
  "fr": "Poudrière",
  "ota": {
   "latn": "Baruthane",
   "arab": "باروت خانه"
  },
  "modern": "Kağıthane Baruthanesi (lost)",
  "lit": {
   "fr": {
    "en": "Powder magazine",
    "tr": "Baruthane"
   },
   "ota": {
    "en": "Powder house",
    "fr": "Maison à poudre",
    "tr": "Barut evi"
   },
   "modern": {
    "en": "Kağıthane powder mill",
    "fr": "Poudrière de Kağıthane",
    "tr": "Kağıthane baruthanesi"
   }
  },
  "kind": "military",
  "bbox": [
   5618,
   5355,
   5735,
   5400
  ],
  "parts": null,
  "uncertain": true,
  "note": {
   "en": "Italic label just south of Kiahad-Hané, beside a separate curved 'Fontaine'. Identification with the Ottoman powder mill at Kağıthane is a guess",
   "fr": "Étiquette en italique juste au sud de Kiahad-Hané, à côté d'une « Fontaine » courbe distincte. L'identification avec la poudrière ottomane de Kağıthane est une hypothèse",
   "tr": "Kiahad-Hané'nin hemen güneyinde, ayrı bir kavisli 'Fontaine' yanında italik yazı. Kağıthane'deki Osmanlı baruthanesiyle özdeşleştirme bir tahmindir"
  }
 }
]
