[
 {
  "fr": "KÉFÉLI-KEUI",
  "ota": {
   "latn": "Kefeliköy",
   "arab": "كفه لی كوی"
  },
  "modern": "Kefeliköy, Sarıyer",
  "lit": {
   "fr": {
    "en": "Kéféli-keui",
    "tr": "Kefeliköy"
   },
   "ota": {
    "en": "Village of the people of Kefe (Caffa)",
    "fr": "Village des gens de Caffa",
    "tr": "Kefeliler köyü"
   },
   "modern": {
    "en": "Village of the Kefe people",
    "fr": "Village des gens de Kefe",
    "tr": "Kefeliler köyü"
   }
  },
  "kind": "village",
  "bbox": [
   4236,
   4158,
   4440,
   4190
  ],
  "parts": null,
  "uncertain": false,
  "note": {
   "en": "Settled by Crimean Greeks from Kefe (Caffa)",
   "fr": "Peuplé de Grecs de Crimée venus de Kefe (Caffa)",
   "tr": "Kefe'den (Kefe/Caffa) gelen Kırım Rumlarınca kurulmuştur"
  }
 },
 {
  "fr": "Crio-nero, ou Fontaine froide",
  "ota": {
   "latn": "Soğuksu",
   "arab": "صوغوق صو"
  },
  "modern": "Soğuksu kaynağı, Kefeliköy",
  "lit": {
   "fr": {
    "en": "Krio-nero, or Cold Fountain",
    "tr": "Krio-nero, ya da Soğuk Çeşme"
   },
   "ota": {
    "en": "Cold water",
    "fr": "Eau froide",
    "tr": "Soğuk su"
   },
   "modern": {
    "en": "Cold-water spring",
    "fr": "Source d'eau froide",
    "tr": "Soğuksu kaynağı"
   }
  },
  "kind": "water",
  "bbox": [
   4448,
   4172,
   4745,
   4198
  ],
  "parts": null,
  "uncertain": true,
  "note": {
   "en": "Crio-nero is Greek 'kryo nero', cold water; the Ottoman name Soğuksu is reconstructed",
   "fr": "Crio-nero est le grec « kryo nero », eau froide ; le nom ottoman Soğuksu est reconstitué",
   "tr": "Crio-nero, Rumca 'kryo nero', soğuk su demektir; Osmanlıca Soğuksu adı tahmine dayanır"
  }
 },
 {
  "fr": "Mont Alonaki",
  "ota": null,
  "modern": "Alonaki tepesi, Kefeliköy (unidentified)",
  "lit": {
   "fr": {
    "en": "Mount Alonaki",
    "tr": "Alonaki Dağı"
   },
   "ota": null,
   "modern": {
    "en": "Alonaki hill",
    "fr": "Colline d'Alonaki",
    "tr": "Alonaki tepesi"
   }
  },
  "kind": "mountain",
  "bbox": [
   4292,
   4252,
   4432,
   4282
  ],
  "parts": null,
  "uncertain": true,
  "note": {
   "en": "Alonaki is Greek for 'little threshing floor'",
   "fr": "Alonaki signifie « petite aire de battage » en grec",
   "tr": "Alonaki, Rumca 'küçük harman yeri' demektir"
  }
 },
 {
  "fr": "Kirk-agatch ou Bouquet de Platanes",
  "ota": {
   "latn": "Kırkağaç",
   "arab": "قرق آغاج"
  },
  "modern": "Kırkağaç, Kefeliköy (lost)",
  "lit": {
   "fr": {
    "en": "Kirk-agatch, or Clump of Plane-trees",
    "tr": "Kırkağaç, ya da Çınar Korusu"
   },
   "ota": {
    "en": "Forty trees",
    "fr": "Quarante arbres",
    "tr": "Kırk ağaç"
   },
   "modern": {
    "en": "Forty trees",
    "fr": "Quarante arbres",
    "tr": "Kırk ağaç"
   }
  },
  "kind": "forest",
  "bbox": [
   3990,
   4250,
   4200,
   4306
  ],
  "parts": [
   [
    4018,
    4250,
    4165,
    4273
   ],
   [
    3990,
    4280,
    4200,
    4306
   ]
  ],
  "uncertain": true,
  "note": {
   "en": "A plane-tree grove on the shore below Kefeliköy; the site is not identifiable today",
   "fr": "Un bosquet de platanes sur le rivage sous Kefeliköy ; le site n'est plus identifiable aujourd'hui",
   "tr": "Kefeliköy'ün altındaki kıyıda bir çınar korusu; yeri bugün tespit edilemiyor"
  }
 },
 {
  "fr": "Vallon et Prairies de Buyuk-déré",
  "ota": {
   "latn": "Büyükdere Çayırı",
   "arab": "بیوك دره چایری"
  },
  "modern": "Büyükdere Çayırı, Sarıyer",
  "lit": {
   "fr": {
    "en": "Valley and Meadows of Büyükdere",
    "tr": "Büyükdere Vadisi ve Çayırları"
   },
   "ota": {
    "en": "Meadow of Büyükdere",
    "fr": "Prairie de Büyükdere",
    "tr": "Büyükdere çayırı"
   },
   "modern": {
    "en": "Büyükdere meadow",
    "fr": "Prairie de Büyükdere",
    "tr": "Büyükdere çayırı"
   }
  },
  "kind": "other",
  "bbox": [
   4112,
   4368,
   4265,
   4670
  ],
  "parts": [
   [
    4118,
    4371,
    4208,
    4665
   ],
   [
    4195,
    4438,
    4261,
    4665
   ]
  ],
  "uncertain": false,
  "note": {
   "en": "Two vertical lines; the famous meadow with the 'Seven Brothers' plane tree",
   "fr": "Deux lignes verticales ; la célèbre prairie au platane des « Sept Frères »",
   "tr": "İki dikey satır; 'Yedi Kardeşler' çınarıyla ünlü çayır"
  }
 },
 {
  "fr": "les quatre Chemins",
  "ota": null,
  "modern": "Dörtyol kavşağı, Kefeliköy (unidentified)",
  "lit": {
   "fr": {
    "en": "The Four Roads",
    "tr": "Dört Yol"
   },
   "ota": null,
   "modern": {
    "en": "Four Roads crossroads",
    "fr": "Carrefour des Quatre-Chemins",
    "tr": "Dörtyol kavşağı"
   }
  },
  "kind": "road",
  "bbox": [
   4372,
   4406,
   4576,
   4434
  ],
  "parts": null,
  "uncertain": true,
  "note": null
 },
 {
  "fr": "Ruines d'un Monastère",
  "ota": null,
  "modern": "Yıkık manastır, Kireçburnu (unidentified)",
  "lit": {
   "fr": {
    "en": "Ruins of a Monastery",
    "tr": "Bir manastırın harabeleri"
   },
   "ota": null,
   "modern": {
    "en": "Ruined monastery",
    "fr": "Monastère en ruine",
    "tr": "Yıkık manastır"
   }
  },
  "kind": "ruin",
  "bbox": [
   4633,
   4346,
   4880,
   4376
  ],
  "parts": null,
  "uncertain": true,
  "note": null
 },
 {
  "fr": "BAKTCHÉ-KEUI",
  "ota": {
   "latn": "Bağçeköy",
   "arab": "باغچه كوی"
  },
  "modern": "Bahçeköy, Sarıyer",
  "lit": {
   "fr": {
    "en": "Baktché-keui",
    "tr": "Bahçeköy"
   },
   "ota": {
    "en": "Garden village",
    "fr": "Village du Jardin",
    "tr": "Bahçe köyü"
   },
   "modern": {
    "en": "Garden village",
    "fr": "Village du Jardin",
    "tr": "Bahçe köyü"
   }
  },
  "kind": "village",
  "bbox": [
   3776,
   4803,
   3983,
   4833
  ],
  "parts": null,
  "uncertain": false,
  "note": null
 },
 {
  "fr": "Aquéduc de Baktché-keui ou d'Ibrahim",
  "ota": {
   "latn": "Bağçeköy Kemeri",
   "arab": "باغچه كوی كمری"
  },
  "modern": "Bahçeköy Kemeri, Sarıyer",
  "lit": {
   "fr": {
    "en": "Aqueduct of Baktché-keui, or of Ibrahim",
    "tr": "Bahçeköy ya da İbrahim Su Kemeri"
   },
   "ota": {
    "en": "Arch (aqueduct) of Bahçeköy",
    "fr": "Arche (aqueduc) de Bahçeköy",
    "tr": "Bahçeköy kemeri"
   },
   "modern": {
    "en": "Bahçeköy aqueduct",
    "fr": "Aqueduc de Bahçeköy",
    "tr": "Bahçeköy kemeri"
   }
  },
  "kind": "infrastructure",
  "bbox": [
   3926,
   4836,
   4253,
   4893
  ],
  "parts": [
   [
    3931,
    4836,
    4253,
    4863
   ],
   [
    4018,
    4866,
    4161,
    4893
   ]
  ],
  "uncertain": true,
  "note": {
   "en": "Also called Sultan Mahmud Kemeri; part of the Taksim water system built under Mahmud I",
   "fr": "Aussi appelé Sultan Mahmud Kemeri ; partie du réseau d'eau de Taksim construit sous Mahmoud Ier",
   "tr": "Sultan Mahmud Kemeri de denir; I. Mahmud döneminde yapılan Taksim su yolunun bir parçasıdır"
  }
 },
 {
  "fr": "AÏAZA",
  "ota": {
   "latn": "Ayazağa",
   "arab": "آیازآغا"
  },
  "modern": "Ayazağa, Sarıyer",
  "lit": {
   "fr": {
    "en": "Aïaza",
    "tr": "Ayaza"
   },
   "ota": {
    "en": "Ayaz Agha",
    "fr": "Ayaz Agha",
    "tr": "Ayaz Ağa"
   },
   "modern": null
  },
  "kind": "village",
  "bbox": [
   4656,
   4846,
   4766,
   4876
  ],
  "parts": null,
  "uncertain": true,
  "note": {
   "en": "Engraved AÏAZA; identification with Ayazağa is a guess",
   "fr": "Gravé AÏAZA ; l'identification avec Ayazağa est une hypothèse",
   "tr": "Haritada AÏAZA yazılı; Ayazağa ile özdeşleştirme bir tahmindir"
  }
 },
 {
  "fr": "DGENDÉRÉ",
  "ota": {
   "latn": "Cendere",
   "arab": "جندره"
  },
  "modern": "Cendere, Kağıthane",
  "lit": {
   "fr": {
    "en": "Dgendéré",
    "tr": "Cendere"
   },
   "ota": {
    "en": "Press, mangle",
    "fr": "Pressoir",
    "tr": "Cendere"
   },
   "modern": null
  },
  "kind": "village",
  "bbox": [
   4960,
   4910,
   5125,
   4942
  ],
  "parts": null,
  "uncertain": false,
  "note": null
 },
 {
  "fr": "Chemin de Belgrade",
  "ota": {
   "latn": "Belgrad Yolu",
   "arab": "بلغراد یولی"
  },
  "modern": "Belgrad Köyü yolu, Belgrad Ormanı",
  "lit": {
   "fr": {
    "en": "Road of Belgrade",
    "tr": "Belgrad Yolu"
   },
   "ota": {
    "en": "Belgrade road",
    "fr": "Chemin de Belgrade",
    "tr": "Belgrad yolu"
   },
   "modern": {
    "en": "Road to Belgrad village, Belgrade Forest",
    "fr": "Route du village de Belgrad, forêt de Belgrade",
    "tr": "Belgrad Köyü yolu"
   }
  },
  "kind": "road",
  "bbox": [
   4312,
   5030,
   4705,
   5135
  ],
  "parts": [
   [
    4315,
    5105,
    4440,
    5132
   ],
   [
    4495,
    5032,
    4702,
    5120
   ]
  ],
  "uncertain": false,
  "note": {
   "en": "Belgrade here is the forest village of Belgrad (cleared in the 1890s), not the city",
   "fr": "Belgrade désigne ici le village forestier de Belgrad (évacué dans les années 1890), non la ville",
   "tr": "Buradaki Belgrad, şehir değil, 1890'larda boşaltılan Belgrad Ormanı'ndaki köydür"
  }
 }
]
