[
  {
    "fr": "Mine de Charbon de terre",
    "ota": null,
    "modern": "Coal mine near Kilyos (lost)",
    "lit": {
      "fr": {
        "en": "Mineral coal mine",
        "tr": "Taş kömürü madeni"
      },
      "ota": null,
      "modern": null
    },
    "kind": "other",
    "bbox": [
      2028,
      3974,
      2208,
      4032
    ],
    "parts": [
      [
        2083,
        3974,
        2164,
        3999
      ],
      [
        2028,
        4003,
        2208,
        4032
      ]
    ],
    "uncertain": true,
    "note": "'Charbon de terre' = mineral coal, as opposed to charcoal; on the Black Sea coast between Rumelifeneri and Kilyos"
  },
  {
    "fr": "Eski-Fanaraki Bournou",
    "ota": {
      "latn": "Eski Fanaraki Burnu",
      "arab": "اسكی فناراكی بورنی"
    },
    "modern": "Kilyos headland, Sarıyer (unidentified)",
    "lit": {
      "fr": {
        "en": "Old Fanaraki Cape",
        "tr": "Eski Fanaraki Burnu"
      },
      "ota": {
        "en": "Cape of the old little lighthouse",
        "fr": "Cap du vieux petit phare",
        "tr": "Eski küçük fener burnu"
      },
      "modern": null
    },
    "kind": "cape",
    "bbox": [
      1393,
      4198,
      1690,
      4226
    ],
    "parts": null,
    "uncertain": true,
    "note": "Fanaraki = Greek 'little lighthouse'; the cape beside Kila Fort (Kilyos). Ottoman form reconstructed from the French"
  },
  {
    "fr": "Ancienne Tour",
    "ota": null,
    "modern": "Old tower at Kilyos, Sarıyer (unidentified)",
    "lit": {
      "fr": {
        "en": "Old Tower",
        "tr": "Eski Kule"
      },
      "ota": null,
      "modern": null
    },
    "kind": "ruin",
    "bbox": [
      1718,
      4210,
      1855,
      4235
    ],
    "parts": null,
    "uncertain": true,
    "note": "Drawn beside Kila Fort on the Kilyos headland; possibly part of the Genoese castle of Kilyos"
  }
]
