[
 {"fr": "MONT MAL-TÉPÉ", "ota": {"latn": "Maltepe", "arab": "مال تپه"}, "modern": "Maltepe (hill)", "lit": {"fr": {"en": "Mount Mal-tépé", "tr": "Maltepe Dağı"}, "ota": {"en": "Treasure Hill", "fr": "Colline du Trésor", "tr": "Mal tepesi"}, "modern": null}, "kind": "mountain", "bbox": [9080, 2420, 9392, 2452], "parts": null, "uncertain": false, "note": "Left edge of the M sits on the chunk boundary"},
 {"fr": "Cap Mal-tépé", "ota": {"latn": "Maltepe Burnu", "arab": "مال تپه بورنی"}, "modern": "Dragos / Maltepe headland", "lit": {"fr": {"en": "Cape Mal-tépé", "tr": "Maltepe Burnu"}, "ota": {"en": "Cape of Treasure Hill", "fr": "Cap de la Colline du Trésor", "tr": "Maltepe burnu"}, "modern": null}, "kind": "cape", "bbox": [9498, 2559, 9708, 2594], "parts": null, "uncertain": true, "note": null},
 {"fr": "Ruines de l'ancien Palais de Vria appartenant aux Empereurs Grecs", "ota": null, "modern": "Bryas Palace ruins, Küçükyalı (Maltepe)", "lit": {"fr": {"en": "Ruins of the old Palace of Vria belonging to the Greek Emperors", "tr": "Rum İmparatorlarına ait eski Vria Sarayı'nın kalıntıları"}, "ota": null, "modern": null}, "kind": "ruin", "bbox": [9012, 2546, 9392, 2610], "parts": [[9016, 2546, 9392, 2580], [9012, 2579, 9356, 2610]], "uncertain": true, "note": "Two-line label spanning the boundary with c_7750_1850; 'Vria' = Bryas, the 9th-century palace of Theophilos (site now read as the Satyros monastery)"},
 {"fr": "PRINKIPO", "ota": {"latn": "Büyükada", "arab": "بیوك آطه"}, "modern": "Büyükada (village)", "lit": {"fr": {"en": "Prinkipo", "tr": "Prinkipo"}, "ota": {"en": "Big Island", "fr": "Grande Île", "tr": "Büyük ada"}, "modern": null}, "kind": "village", "bbox": [9946, 2511, 10094, 2549], "parts": null, "uncertain": false, "note": "The village; the island itself carries a letter-spaced PRINKIPO"},
 {"fr": "Puits des Filles", "ota": null, "modern": "Well of the Girls, Büyükada (lost)", "lit": {"fr": {"en": "Well of the Girls", "tr": "Kızlar Kuyusu"}, "ota": null, "modern": null}, "kind": "infrastructure", "bbox": [10088, 2580, 10170, 2628], "parts": [[10088, 2580, 10170, 2604], [10108, 2604, 10160, 2628]], "uncertain": true, "note": null},
 {"fr": "Citerne circulaire antique", "ota": null, "modern": "Ancient circular cistern, Büyükada", "lit": {"fr": {"en": "Ancient circular cistern", "tr": "Antik yuvarlak sarnıç"}, "ota": null, "modern": null}, "kind": "ruin", "bbox": [10236, 2548, 10306, 2608], "parts": [[10236, 2548, 10286, 2574], [10238, 2566, 10300, 2594], [10250, 2586, 10306, 2608]], "uncertain": true, "note": "Three-line slanted label"},
 {"fr": "Ruines d'Édifices antiques", "ota": null, "modern": "Ruins of ancient buildings, Büyükada", "lit": {"fr": {"en": "Ruins of ancient buildings", "tr": "Antik yapı kalıntıları"}, "ota": null, "modern": null}, "kind": "ruin", "bbox": [10282, 2477, 10446, 2528], "parts": [[10282, 2477, 10446, 2508], [10340, 2503, 10402, 2528]], "uncertain": true, "note": null},
 {"fr": "Monastère du Christ", "ota": null, "modern": "Hristos (Metamorphosis) Monastery, İsa Tepesi, Büyükada", "lit": {"fr": {"en": "Monastery of Christ", "tr": "Hristos Manastırı"}, "ota": null, "modern": null}, "kind": "religious", "bbox": [10278, 2664, 10468, 2692], "parts": null, "uncertain": false, "note": null},
 {"fr": "Mon. de St Georges", "ota": null, "modern": "Aya Yorgi (St George Koudounas) Monastery, Yücetepe, Büyükada", "lit": {"fr": {"en": "Monastery of St George", "tr": "Aya Yorgi Manastırı"}, "ota": null, "modern": null}, "kind": "religious", "bbox": [10252, 2712, 10333, 2760], "parts": [[10254, 2712, 10333, 2734], [10252, 2734, 10310, 2760]], "uncertain": true, "note": "Tiny two-line label in the hill hatching south-west of the İsa Tepesi building; first word abbreviated, reading is a guess. A second, fainter 'Monastère de St George' sits by the Yücetepe building in c_10450_1850"},
 {"fr": "Reste d'une Citerne", "ota": null, "modern": "Cistern remains, Sedef Adası", "lit": {"fr": {"en": "Remains of a cistern", "tr": "Bir sarnıç kalıntısı"}, "ota": null, "modern": null}, "kind": "ruin", "bbox": [10362, 2402, 10542, 2431], "parts": null, "uncertain": true, "note": "On Anterovitos / Sedef Adası"},
 {"fr": "KHALKY", "ota": {"latn": "Heybeliada", "arab": "هیبه لی آطه"}, "modern": "Heybeliada (village)", "lit": {"fr": {"en": "Chalki", "tr": "Halki"}, "ota": {"en": "Saddlebag Island", "fr": "Île de la Besace", "tr": "Heybeli ada"}, "modern": null}, "kind": "village", "bbox": [9891, 2962, 10006, 2992], "parts": null, "uncertain": false, "note": "Greek Chalki, 'copper island'"},
 {"fr": "Monastère de St Nicolas", "ota": null, "modern": "Aya Nikola Monastery, Heybeliada", "lit": {"fr": {"en": "Monastery of St Nicholas", "tr": "Aya Nikola Manastırı"}, "ota": null, "modern": null}, "kind": "religious", "bbox": [10088, 2993, 10370, 3018], "parts": null, "uncertain": false, "note": null},
 {"fr": "Monastère de la Trinité", "ota": null, "modern": "Aya Triada Monastery (Halki Seminary), Heybeliada", "lit": {"fr": {"en": "Monastery of the Trinity", "tr": "Aya Triada Manastırı"}, "ota": null, "modern": null}, "kind": "religious", "bbox": [9702, 3090, 9926, 3122], "parts": null, "uncertain": false, "note": null},
 {"fr": "Mon. de St Georges", "ota": null, "modern": "Aya Yorgi Uçurum Monastery, Heybeliada", "lit": {"fr": {"en": "Monastery of St George", "tr": "Aya Yorgi Manastırı"}, "ota": null, "modern": null}, "kind": "religious", "bbox": [9974, 3093, 10158, 3122], "parts": null, "uncertain": true, "note": null}
]
